{
  "schema_version": "1.0.0",
  "methodology_version": "4.0.0",
  "updated_at": "2026-10-26",
  "author": "Codex research assistant",
  "context": {
    "purpose": "Preserve completed E01/EP01 descriptive methodology; add provisional RG discount-regression specifications and cluster infrastructure. No empirical regression executed in this stage.",
    "dataset_ids": [
      "wrds_samsung_daily_v2",
      "user_vendor_definitions_20261022"
    ],
    "source_registry": "research/source_inventory.json",
    "configuration": "configs/samsung_descriptive.json plus configs/samsung_e01.json",
    "identity": "gvkey=104604; preferred iid=01W ISIN=KR7005931001 ticker=005935 tpci=1; common iid=02W ISIN=KR7005930003 ticker=005930 tpci=0; exchg=248; curcdd=KRW",
    "frequency": "Daily observed dates; Asia/Seoul local dates. Exact close timestamp absent; same venue/date alignment, not verified synchronized ticks.",
    "calendar": "Session proxy: union of dates with at least one eligible local quote. Missing pairs retained on this grid. Both-carried/absent-both dates are not assumed sessions. Independent KRX calendar unavailable. Full vendor union dates and absent-both weekdays used to break plotted lines.",
    "sample": "Full available 2005-2026 sample; raw-price panels since 2019-01-01. Main retains eligible flagged observations; sensitivity masks all flagged dates before summary, differences and rolling calculations, without dropping grid rows. No price or volume fill.",
    "eligibility": "Exact identity/currency/exchange/type mapping; finite positive PRCCD; QUNIT=1; PRCSTD=10; weekday; reject available inconsistent high/low. Volume is not an eligibility gate. Unknown statuses excluded. Missing either class excludes date; duplicate keys or descriptor mismatches abort.",
    "carried_and_stale": "Vendor status 5 is carried forward and excluded even if volume exists. Status 10 may have missing volume when price changes. Unchanged traded closes retained, not automatically stale. Missing/nonpositive volume separately flagged, never filled.",
    "corporate_actions": "Raw-price discount only; contemporaneous QUNIT=1 verified. AJEXDI and split events inventoried without adopting an adjustment formula. All adjusted prices, indexes and returns deferred. No TRFD or dividend adjustment used.",
    "availability": "Effective observation date=datadate; availability/publication/retrieval dates and vendor revision vintage unknown. Filesystem dates are not retrieval evidence. Descriptive retrospective study only.",
    "windows": "Adjacent observed-session discount differences. Trailing 20 session-endpoint changes, sample standard deviation ddof=1, minimum 20 finite changes, no annualization. Thus requires 21 valid consecutive price observations. No lookahead or centered window. Yearly equal-observation boxplots; 2026 partial through input end.",
    "validation": "unittest synthetic arithmetic/split/join/filter fixtures; complete-key and finite-value checks; registry JSON Schema; Markdown parity; raw SHA-256 before/after; issuer ISIN/split cross-check; additional independent historical price and calendar reconciliation still pending",
    "limitations": [
      "Observed gap is not identified vote value",
      "Adjustment formula unresolved; split-adjusted panel deferred",
      "Independent session calendar and quote reconciliation incomplete",
      "Vendor exchange/type code tables and export metadata incomplete",
      "Full historical rights/action audit incomplete",
      "No return, factor-regression or trade-feasibility inference"
    ],
    "regression_extension": "docs/regressions/README.md; configs/samsung_regressions.json version 1.0.0; gap changes only, explicit source/calendar/availability gates; no adjusted returns manufactured."
  },
  "measures": [
    {
      "id": "preferred_discount",
      "name": "Observed preferred-share discount",
      "version": "2.0.0",
      "status": "implemented",
      "author": "Codex",
      "hypothesis_ids": [
        "H0",
        "H1",
        "H2",
        "H3",
        "H4",
        "H5",
        "H6",
        "H7"
      ],
      "formula": "discount_pct(t)=100*(1-prccd_preferred(t)/prccd_common(t))",
      "symbols": "t=same valid local date; prccd_j=unadjusted closing price of class j; both qunit=1 and KRW",
      "unit": "percent; changes in percentage points",
      "sign_convention": "Positive means preferred cheaper than common; negative values retained",
      "inputs": [
        "prccd",
        "qunit",
        "prcstd",
        "cshtrd",
        "datadate",
        "gvkey",
        "iid",
        "isin",
        "curcdd",
        "exchg",
        "tpci",
        "prchd",
        "prcld"
      ],
      "implementation_ref": "src/samsung_research/e01.py:match_pair",
      "example": "Common=100, preferred=80 gives 20%; common premium relative to preferred would be 25%, a different denominator.",
      "limitations": [
        "Includes every class difference; cash-flow and voting rights not equal by assumption",
        "Spot-price gap excludes dividend reinvestment"
      ]
    },
    {
      "id": "split_adjusted_price",
      "name": "Split-adjusted price",
      "version": "2.0.0",
      "status": "deferred",
      "author": "Codex",
      "hypothesis_ids": [
        "H0"
      ],
      "formula": "Unresolved; no calculation authorized in version 2.0.0",
      "symbols": "j=common or preferred; ajexdi=cumulative issue adjustment by ex-date, required finite and positive",
      "unit": "KRW per share on vendor adjustment basis",
      "sign_convention": "Positive prices; no return interpretation before indexing",
      "inputs": [
        "prccd",
        "qunit",
        "ajexdi",
        "split"
      ],
      "implementation_ref": "src/samsung_research/e01.py:adjusted_price (raises; disabled)",
      "example": "No adjusted-price example adopted until underlying vendor definition and formula are confirmed.",
      "limitations": [
        "Supersedes prior adjustment assumption; archived v1 panel not current evidence"
      ]
    },
    {
      "id": "indexed_price",
      "name": "Indexed split-adjusted price",
      "version": "2.0.0",
      "status": "deferred",
      "author": "Codex",
      "hypothesis_ids": [
        "H0",
        "H7"
      ],
      "formula": "Unresolved; no calculation authorized in version 2.0.0",
      "symbols": "t0=first date with both price-eligible classes and positive ajexdi; same base date for both classes",
      "unit": "index points, t0=100",
      "sign_convention": "Rising means split-adjusted price appreciation relative to own initial price",
      "inputs": [
        "split_adjusted_price"
      ],
      "implementation_ref": "src/samsung_research/e01.py:adjusted_price (raises; disabled)",
      "example": "No adjusted-price example adopted until underlying vendor definition and formula are confirmed.",
      "limitations": [
        "Supersedes prior adjustment assumption; archived v1 panel not current evidence"
      ]
    },
    {
      "id": "quality_audit",
      "name": "Coverage and discontinuity diagnostics",
      "version": "2.0.0",
      "status": "implemented",
      "author": "Codex",
      "hypothesis_ids": [
        "H0"
      ],
      "formula": "Raw-row and unique-date counts as labeled; missing=blank. Duplicate excess=N-N_unique(gvkey,iid,datadate). Paired coverage=N_valid/N_union. Equal-observation median. Review flags: absolute adjacent matched-date discount change >5pp or gap >10 calendar days; flags never remove values. Factor changes inventoried only; adjusted returns not computed. Old/new raw rows compared field-by-field by gvkey/iid/date; revised fields and missing keys reported.",
      "symbols": "N=row/date count as labeled; observed-date changes can span sessions; thresholds from config",
      "unit": "counts, percent, percentage points, fractions, or calendar days as labeled",
      "sign_convention": "Missing is distinct from zero; repeated price is distinct from carried status",
      "inputs": [
        "all exported fields",
        "preferred_discount",
        "split_adjusted_price"
      ],
      "implementation_ref": "src/samsung_research/e01.py:audit",
      "example": "Three rows with two unique keys give one duplicate excess; a missing common row prevents a pair even if preferred trades.",
      "limitations": [
        "Missing business weekdays are not identified missing trading sessions without KRX calendar",
        "Large moves are review flags, not automatically data errors"
      ]
    },
    {
      "id": "discount_change",
      "name": "Daily observed-session discount change",
      "version": "1.0.0",
      "status": "implemented",
      "author": "Codex",
      "hypothesis_ids": [
        "H0",
        "H7"
      ],
      "formula": "delta_d(t)=d(t)-d(t-1) on original observed-session proxy grid; missing if either endpoint missing or masked",
      "symbols": "d=preferred discount in percent; t-1=adjacent proxy session, not previous surviving row",
      "unit": "percentage points",
      "sign_convention": "As defined in formula; positive discount change means widening",
      "inputs": [
        "preferred_discount"
      ],
      "example": "20% to 21.5% gives +1.5pp, not a 7.5% return.",
      "limitations": [
        "Not a security return",
        "Calendar gaps may span holidays or unobserved sessions"
      ],
      "implementation_ref": "src/samsung_research/descriptive.py:build_measures"
    },
    {
      "id": "annual_distribution",
      "name": "Annual discount distribution",
      "version": "1.0.0",
      "status": "implemented",
      "author": "Codex",
      "hypothesis_ids": [
        "H0",
        "H7"
      ],